name,fileorder,number,parkprop,borough,parkname,parknumber,commboard,council,Location,extant,dedicated,cast,descrip,dimen,sponsor,materials,foundry,fabricator,sculptor,architect,donor,maintain,contractor,Name2,Name3,MaintainedByParks,Installation,Rededication,Cost,Categories,inscribed,X,Y
"quinn, matthew d.",,1308,N,Queens,,,0,0,LONG ISLAND CITY; academy st. near grand Avenue,Y,,,tablet,,,bronze,tiffany studios,,,,gift. $405,,,,,,,,,,,,
"Conway, Frank Tablet",,327,N,the Bronx,,,0,0,,M,,,,,,,,,,,,,,,,,,,,,,,
Cigarette,Cigarette,1937,N,Manhattan,,,5,3,"The Museum of Modern Art, 11 West 53rd Street",Y,June 1980,1971,geometric form,"h 15'1"" x w 25'6"" x d 18'7""",,steel (painted black),,"Industrial Welding, Newark, NJ",Tony Smith,,Museum of Modern Art,,,,,,,,,,,,
Philosophy,,1181,O,Manhattan,Bryant Park,M008,5,3,New York Public Library; 42nd St. and 5th Avenue,Y,1915,,statue,,,,,,Paul Wayland Bartlett,,purchase,,,,,,,,,,,,
Giuseppe Garibaldi,"Garibaldi, Giuseppe",571,Y,Manhattan,Washington Square Park,M098,2,1,,Y,"June 4, 1888",1888,Standing figure (over life-size) on integral plinth on pedestal,"H: 20'8"" W: 10' D: 10'",,Bronze and Clark's Island? or Westerly? Granite,Henry Bonnard Bronze Company,"Lazzari & Barton Woodlawn, N.Y.",Giuseppe Turini,,Italian-Americans,,,,,Y,,,,Politcal Figure,,985120.0162926316,205443.46383473277
O'Connor Park,,1125,Y,Queens,Raymond M. O'Connor Field,Q103,11,19,210TH ST.; 32nd to 33rd Avenues,M,,,flagstaff with capt. trench mortars,,,mortars probably salvaged,,,,,,,,,,,,,,"War Memorial, World War I",,,
Alexander Hamilton,,663,N,Manhattan,,,1,1,"COUNTY COURT HOUSE, ROOM 315; chambers and centre sts",Y,,,bust,,,plaster,,,,,,,,,,,,,,,,,
Commerce,Commerce,306,N,Manhattan,,,1,1,"Surrogate's Court/Hall of Records, 31 Chambers Street, Elk Street elevation, beside center window in attic",Y,1903,ca. 1903,seated female figure (heroic scale),,,Westerly granite,,,Henry Kirke Bush-Brown,Horgan and Slattery,"$75,000 (total for all 47 sculptures originally in and on Surrogate's Court/Hall of Records); purchase",,,,,,,,,Sculpture,,,
Rockaway Whale,,1985,N,Queens,,Q163A,,,"Shore Front Parkway and Beach 95th Street, Rockaway",N,,,Large-scale white whale with colored tile mosaics,,,,,,,,,,,,,,,,,,,,
Madonna,,963,O,Brooklyn,Brooklyn Institute of Arts and Sciences,B048,9,35,BROOKLYN MUSEUM; 200 eastern parkway,Y,1900,,bust,,,,,,william o. partridge,,george foster peabody,,,,,,,,,,,,
roman law giver,,1368,O,Brooklyn,Brooklyn Institute of Arts and Sciences,B048,9,35,BROOKLYN MUSEUM; eastern parkway,Y,1909,,statue,,,indiana limestone,,,john gelert,,purchase $3000.,,,,,,,,,,,,
Luminescence,,2167,Y,Q,,Q471,2,26,Center Boulevard and 54th Avenue,Y,6/27/18,,seven cast concrete domes representing the phases of the moon,"6' Diameter x 1 1/4' Tall (Each Moon), 66' Diameter Semicircle (Installation)",,"White Portland cement integrated with phosphorous particles, pigment, and reflective silicon carbide grains",,Dura Art Stone,Nobuho Nagasawa,"Thomas Balsley, Landscape Architect","Percent for Art, Economic Development Corportation",,,,,Y,11/11/2017,,,"Abstract, Other",,994911.2785342187,209212.81456372142
"Skycycles 1, 2, 3",,2164,Y,Staten Island,,R149,2,50,Field Athletic Complex; Quintard Street & Mason Avenue,Y,December 2015,,Three 'flying bicycle' scultpures,"1: W: 11' L: 8'11"" H: 5'3""; 2: W: 12' L: 6'3"" H: 3'6""; 3: W: 15' L: 8'9"" H: 4'8""",,Steel and aluminum,,Paul Villinski Studio,Paul Villinski,,DCA Percent for Art,,,,,Y,11/12/2015,,,,,963306.0182540566,151639.973016724
One Hundred Fifty Seventh St. Subway,,1139,N,Manhattan,,,9,7,157TH ST. SUBWAY; uptown side,Y,1913,,tablet,"1'h x 2'5""",,white vermont marble,,s. klaber & co.,,,"purchase, $50.",,,,,,,,,,,,
Forest Park Honor Roll,,515,Y,Queens,Forest Park,Q015,16,30,"Myrtle Avenue, Union Turnpike, Park Lane",M,1920,,,,,,John Polachek Bronze Co,,,,,,,,,,,,,"War Memorial, World War I",,,
"shepard, edward morse",,1435,N,Manhattan,,,9,7,CCNY; convent ave at 137th st,Y,1912,,tablet,,,bronze,j. & r. lamb,,,,,,,,,,,,,,,,
Guadalcanal Heroes,,647,Y,Manhattan,Riverside Park,M071,0,6,,M,apprvd art comis 9/10/47,,Plaque on plinth,,,,,,,,Marine Fathers Association,,,,,,,,,"World War II, War Memorial",,,
Jeffrey's Hook Lighthouse Plaque,,810,Y,Manhattan,Fort Washington Park,M028,12,7,Under George Washington Bridge,Y,,,granite marker identifying historic lighthouse,,,Granite,,,,,,,,,,Y,,,,Literary Character,,998923.9742489755,249046.8165884763
Hon. James A. Hatch,,685,Y,Manhattan,Washington Square Park,M098,2,1,Northeast corner,S,1949,,Tablet on base,"9"" x 12""",,"Bronze, granite plinth",,"United States Bronze Signs Co., Inc.",,,Freda B. Hatch,,,,,,,,,"Public Servant, Politcal Figure",,,
Father Studzinski Memorial,,2221,N,Brooklyn,,,1,,McGuinness Blvd and Driggs Avenue,Y,1963,1963; recast 2017,Stele with plaque,"3'6"" L x 2' W x 5' H","St. Stanislaus Memorial Post 1771, American Legion",barre granite and bronze,,Giudici Bro and Meier Johan Wengler,Pulaski Monument Co.,,,,,,,Y,,04/22/2017,,"Christian, Religious Leader, Portrait",,,
Confucius,,317,N,Manhattan,,,5,2,APPELLATE COURT; Madison Avenue and 25th Street,Y,1899,,statue,,,,,,Philip Martiny,,purchase,,,,,,,,,Sculpture,,,
Highbridge World War I Memorial,,720,Y,the Bronx,,X030,4,16,161st Street and Jerome Avenue,Y,1923,,"Statue, pedestal with dedicatory plaque","H: 15'9"" W: 8'8"" D: 8'8""",,Bronze and Maine granite,J.W. Fiske Iron Works,,,Max Hausle,Highbridge Regular Democratic Club,,,Highbridge Doughboy,,Y,,09/28/2018,6000.00,"War Memorial, World War I, Soldier",,1003806.9070683867,241587.92271363735
Marine Park Plaque,,977,Y,Queens,Marine Park,Q028,14,32,MARINE PARK,M,,,,,,bronze,,,,,approved by art comm. 5/71,,,,,,,,,,,,
Æsculapius,Aesculapius,8,N,Manhattan,,,9,7,"City College Library, Convent Avenue at 139th Street",Y,1931,ca. 1931,Bust,,,Bronze,,,,,$50; Dr. Francis Huber,,,,,,,,,,,,
Dolphins,dolphins,391,Y,Manhattan,,,0,0,,M,,,,,,,,,,,,,,,,,,,,,,,
Admiral George Dewey Memorial,"Dewey, George",1783,Y,Manhattan,Battery Park,M005,1,1,"Upper Promenade, southwest of Castle Clinton",Y,"May 3, 1973",1973,Plaque with two relief medallions on plinth,"Plaque H: 3'9"" W: 2'8"" D: 1""; Plinth H: 4' W: 3'4"" D: 2'8""",,"Bronze, Barre granite (Presbrey-Leland Company)","U.S. Bronze Sign Company, NY",,Daniel Chester French (replica medallions based on French's originals),,"Eighteen civic, veterans', and historical associations, under auspices of American Battle Monuments Commission",,,,,Y,,,"$7,000","Portrait, Sculpture, Soldier, War Memorial, Spanish-American War",,979539.7617051303,195380.20443372428
greek epic poetry,,627,O,Brooklyn,Brooklyn Institute of Arts and Sciences,B048,9,35,BROOKLYN MUSEUM; eastern parkway,Y,1909,,statue,,,indiana limestone,,,daniel chester french,,purchase; $3000.,,,,,,,,,,,,
Archimedes,Archimedes,43,N,Brooklyn,,,0,0,"Brooklyn Technical High School, Flatbush Avenue and Concord Street",Y,1934,1934,relief plaque,,,,,,W. Bimel Kehm,,,,,,,,,,,Sculpture,,,
Drama,drama,402,O,Manhattan,Bryant Park,M008,5,3,New York Public Library; 42nd St. and 5th Avenue; East façade,Y,,,statue,,,,,,Paul Wayland Bartlett,,purchase,,,,,,,,,,,,
triumph of law,,1574,N,Manhattan,,,5,2,APPELLATE COURT -25TH ST. FAC; madison ave at 25th st.,Y,,,pediment group,,,,,,charles henry niehaus,,"purchase $30,000.",,,,,,,,,,,,
public school #94,,1284,N,Queens,,,0,0,LITTLE NECK; 250th st. betwn 41st and 42nd Avenue,Y,1922,,tablet,,,bronze,,,maxfield h. keck,,"gift of members of school, $480",,,,,,,,,,,,
Washington Heights Evening High School,,1653,N,Manhattan,,,9,7,P.S. 186; Amsterdam Avenue btwn 145-146th St.,Y,1922,,tablet,,,bronze,,,Maxfield Keck,,gift $760.,,,,,,,,,,,,
"poe, edgar allan",,1192,N,Manhattan,,,7,6,84TH ST. W. OF BROADWAY; nw corner of building,Y,,,tablet,,,,,,,,,,,,,,,,,,,,
public school #87,,1279,N,Queens,,,0,0,MIDDLE VILLAGE; 80th st. and 68th Avenue,Y,1921,,stele with tablet,,,,john polacheck bronze co.,,,,"gift, $1300",,,,,,,,,,,,
wisdom,,1716,N,Manhattan,,,5,2,APPELLATE COURT BLDG ENTRANCE; madison avenue at 25th st,Y,1900,,statue,,,,,,Frederick Wellington Ruckstull,,"purchase $10,000.",,,,,,,,,,,,
greek architecture,,625,O,Brooklyn,Brooklyn Institute of Arts and Sciences,B048,9,35,BROOKLYN MUSEUM; eastern parkway,Y,1909,,statue on roofline,,,indiana limestone,,,Herbert Adams,,"purchase, $3000.",,,,,,,,,,,,
"washington, george bust",,1672,N,Manhattan,,,1,1,CITY HALL; governors room,Y,,,bust,,,plaster,,,,,,,,,,,,,,,,,
"Ciccarone, Pvt. V.","ciccarone, pvt. v.",247,Y,the Bronx,,,0,0,Stolen prior to 1971,M,,,,,,,,,,,,,,,,,,,,,,,
General Edward Fowler,"Fowler, Edward",547,Y,Brooklyn,,BZ032,2,35,"Fowler Square: Lafayette Avenue, Fulton Street, South Elliott Place",Y,"May 18, 1902",1902,"Standing figure (over life size) on integral plinth on pedestal  with wreath containing letters  of name, and plaque","Figure H: 7'11""; Pedestal H: 6'4"" Diameter 7'2""; Plaque H: 1'9 1/2 "" W: 2' 1/2""","$7,000.00 plus interest on bonds","Bronze, Quincy granite (polished)",Henry Bonnard Bronze Company,,Henry Baerer,,City of Brooklyn,,,,,Y,,,,"Civil War, War Memorial, Sculpture, Soldier",,991009.765667975,189552.50874006748
"zenger, john peter",,1741,N,the Bronx,P.S. 18 and Patterson Houses Playground,X155,1,17,P.S. #18; morris ave at 146th st.,Y,1951,,portrait statue,10'h,,limestone,,,joseph kislewski,,purchase,,,,,,,,,,,,
Connolly,,320,N,Brooklyn,,,4,37,P.S. 113; Evergreen Avenue and Moffat St.,Y,1931,,tablet,,,bronze,,,,superb bronze company,gift of teachers of p.s 113,,,,,,,,,,,,
"Hazen, Irving A.",,690,N,Staten Island,,,1,49,RICHMOND HILL HIGH SCHOOL  - Now South Richmond High School,Y,1930,,plaque,no size,,bronze,birmingham gild ltd,,,,"board of education, $150.",,,,,,,,,,,,
"Foster, Rebecca Salome",,541,N,Manhattan,,,1,1,CRIMINAL COURTS BUILDING; 100 Centre Street,Y,1903,,relief,,,marble in gilt frame,,,Karl Bitter,Chas. Rollinson Lamb,gift,,,,,,,,,,,,
"radgik, abraham",,1309,N,the Bronx,,,0,0,,Y,,,,,,,,,,,,,,,,,,,,,,,
Sheepshead Bay Fishing Piers Improvements,,2198,Y,Brooklyn,,B393,15,48,Emmons Ave. bet. Ocean Ave. and E. 26 St,Y,1994,1994,Ten terrazzo ottomons and flagpoles with revolving galvanized steel painted flag/pennants at the top of each pole,"Ottoman: 7'D x 3'5""H; Flagpole: 34'H",Percent for Art,"terrazzo, steel",,,Scott Burton,Michael J. Koenen,Percent for Art,,,Design Team Project,,N,,,,,,,
New York City AIDs Memorial,,2170,Y,M,,M404,2,3,12th Street and Greenwich Avenue,Y,"December 1, 2016",,Abstract canopy with engraved paving and fountain,,,"painted structural steel, granite, stainless steel",,,Jenny Holzer (insribed granite paving),"Studio ai, Mateo Paiva",NYC AIDS Memorial Organization,,,,,N,,,,"Abstract, Other",,,
Grand Army Plaza Urns,,610,Y,Brooklyn,Grand Army Plaza,B040,19,33,GRAND ARMY PLAZA - IN STORAGE,S,,c.1898-1902?,Urns,"Total Height from base to highest point of snake handle: approx. 29 1/2"" highBase: approx. 16 3/4"" wideWidth of urn from snake handles: approx. 36""",,Bronze,,,,Stanford White,,,,,,,,,,,,,
Boy and Girl,,143,N,Manhattan,,,0,0,,Y,,,,,,,,,,,,,,,,,,,,,,,
General Casimir Pulaski,,1289,Y,the Bronx,Pulaski Park,X041,1,8,"PULASKI PARK -E. END OF PARK; e. 133rd st, willis ave at willis bridge",N,1938,,"flagstaff base, tablet - stolen 1976","24""h x 35""w x 1""d",,"bronze, concrete",,,,,,,,,,,,,,"War Memorial, Revolutionary War",,,
Van Pelt Manor,,1615,Y,Brooklyn,Milestone Park,B063,11,50,HOUSE DEMOLISHED IN 1952-53; 81st st. and 18 Avenue -tablet in storage,M,1923/25,,tablet,"20""h x 30""w",,bronze,,,g.r. bibbladdo,,l.i. st. soc. dghtrs of rev. $200,,,,,,,,,,,,
peristyle,,2226,,,,,,,,,,,,,,,,,,,,,,,,,,,,,,,
Harlem Heights Middle Redoubt Marker,Harlem Heights Middle Redoubt Marker,679,N,Manhattan,,,9,7,"east section of Trinity Cemetery, Broadway and 153rd Street",Y,"May 5, 1929",ca. 1929,plaque on boulder,"h 1'10"" x w 1'5""",,plaque--bronze; boulder--granite,,,Paul Wayland Bartlett,,"Washington Heights Chapter, National Society of Daughters of the American Revolution",,,,,,,,,"War Memorial, Revolutionary War",,,
Giovanni da Verrazzano,"Verrazano, Giovanni da",1628,Y,Manhattan,Battery Park,M005,1,1,North entrance pathway,Y,"October 6, 1909",1909,Elevated male half figure and standing female figure (both heroic scale) on pedestal consisting of two perpendicular slabs,"half figure h 5' (?); standing figure h 9'; original total h 27' x w 11'6"" x d 11'6""",,"Bronze, Deer Isle granite",Roman Bronze Works,,Ettore Ximenes,,Charles Barsotti organized public subscription; work donated by artist,,,,,Y,,,"$5,000 (materials only);",Explorer,,979707.7174059749,195900.03475889564
Arthur Cunningham,"Cunningham, Arthur",354,Y,Queens,Cunningham Park,Q021,8,23,Bust inside building near tennis courts.,Y,1941,1941,Bust,"Pedestal H: 8'6"" W: 6' D: 2'",,Bronze,,,Emil Siebern,,,,,,,Y,,,,Public Servant,,1047341.8364025503,205170.7698263079
Cadwallader David Colden,"Colden, Cadwallader David",284,N,Manhattan,,,1,1,"Surrogate's Court/Hall of Records, 31 Chambers Street, Chambers Street façade, chief cornice, seventh from lef",Y,1905,ca. 1905,standing figure (heroic scale),,,Westerly granite,,,Philip Martiny,Horgan and Slattery,"$75,000 (total for all 47 sculptures originally in and on Surrogate's Court/Hall of Records); purchase",,,,,,,,,Sculpture,,,
"loyalty, valor and sacrifice",,948,N,the Bronx,,,4,17,,Y,,,,,,,,,,,,,,,,,,,,,,,
James S.T. Stranahan,"Stranahan, James S.T.",1509,Y,Brooklyn,Prospect Park,B073,0,39,Entrance between East Drive and Flatbush Avenue,Y,"June 6, 1891",ca. 1891,Figure on pedestal,"Statue H: 7'8½"" W: 2'6¾"" D: 2' 9 1/8""; base 2'7"" x 2'7""; pedestal H: 7'4"" W: 6'3"" D: 5'8""; two-step broad base 14'8"" square; total H: 8'5""",,"Bronze (green patina), Knoxville marble (rough), pink granite (polished)",E. Gruet,,Frederick William MacMonnies,Stanford White,Citizens of Brooklyn,,,,,Y,,,"$10,000","Public Servant, Politcal Figure",,992699.0405046344,184158.36040765047
Walter J. Wetzel Memorial,,1699,Y,Queens,,,0,0,Between 157th Street and 156 Avenue,M,,,Tablet and boulder & 3 other tablets,4'h x 4'w x 5'd,,"Granite, bronze",,,,,Gift,,,,,,,,,"Vietnam War, War Memorial",,,
"Ryan, Corporal George P.",,1388,Y,the Bronx,George P. Ryan Square,X043,1,17,143 St. and Morris Avenue,N,1925,,"Tablet on boulder - plaque gone, 1/12/72","1'4""h x 2'w",,"Bronze, natural boulder",,,,,"George Ryan #891, Amer. Legion",,,,,,,,,"War Memorial, World War I",,,
3000 A.D. Diffusion Piece,,2109,Y,Manhattan,,M099,12,10,Haven Avenue between West 173rd Street and West 176th Street,Y,1974,,Monolith of eight magnesium and aluminum plates with steel bolts set on steel base set in concrete pad with plaque,H: 35' W: 3' D: 1',CMCP,"Magnesium, aluminum, steel, concrete",,,Tery Fugate-Wilcox,,Public Arts Council and Neighborhood Action Council,,,,,Y,,,,,,1000286.736943394,247929.5612770617
James Duane,"Duane, James",413,N,Manhattan,,,1,1,"Surrogate's Court/Hall of Records, 31 Chambers Street, Chambers Street façade, chief cornice, eighth from left",Y,1906,ca. 1906,standing figure (heroic scale),,,Westerly granite,,,Philip Martiny,Horgan and Slattery,"$75,000 (total for all 47 sculptures originally in and on Surrogate's Court/Hall of Records); purchase",,,,,,,,,,,,
"Flagstaff, P.S. 9",,492,N,Brooklyn,,,8,35,PUBLIC SCHOOL 9; Vanderbilt Ave. and Sterling Place,Y,1921,,,,,limestone and bronze,,,Robert G. Eberhard,,gift of school,,,,,,,,,,,,
Poetry,Poetry,1196,N,Manhattan,,,1,1,"Surrogate's Court/Hall of Records, 31 Chambers Street, Chambers Street façade, beside center window in attic",Y,1903,ca. 1903,half-reclining male figure (heroic scale),,,Westerly granite,,,Henry Kirke Bush-Brown,Horgan and Slattery,"$75,000 (total for all 47 sculptures originally in and on Surrogate's Court/Hall of Records); purchase",,,,,,,,,,,,
Fallen Angels,,462,O,Brooklyn,Brooklyn Institute of Arts and Sciences,B048,9,35,Eastern Parkway near Washington Avenue,Y,1897,,Group on pedestal,,,,,,Salvatore Albano,,Gift of A. Augustus Healy,,,,,,,,,,,,
"Memorial Grove, Poe Park",,1015,Y,the Bronx,Poe Park,X040,7,15,"Grand Concourse, Kingsbridge Road, 192 and 194th Streets",M,,,"10 tree markers, recessed plinths",,,"granite, cststn, concr, marb, brz",,,,,,,,,,,,,,"World War II, War Memorial",,,
East River Park Anchor,East River Park Anchor,433,Y,Manhattan,East River Park,M144,3,1,Near Grand Street,N,ca. 1970,ca. 1850 (?),"Anchor on base, plaque",,,Anchor--iron; Base--concrete; Plaque--bronze (?),,,,,Downtown Lower Manhattan Association; F. & M. Schaefer Brewing Company,,,,,N,,,,,,990840.7906122208,198982.23955248296
"powers, robert grey",,1218,N,Brooklyn,,,1,34,"P.S. 54; sanford st, willoughby and pulaski st",Y,1926,,tablet,,,bronze,,,maxfield keck,,teachers of school,,,,,,,,,,,,
public school #3,,1262,N,Manhattan,,,0,0,HUDSON AND GROVE STS.,Y,,,tablet,,,bronze,j. and r. lamb,,,,"gift, $300.",,,,,,,,,,,,
Delury Plaza,delury plaza,382,N,Manhattan,,,1,1,LOWER MANHATTAN; Intersection of Fulton and Gold Streets,Y,,,,,,,,,,,,,,,,,,,,,,,
Rockaway Mosaic,Rockaway Mosaic,1361,Y,Queens,Rockaway Park,Q050,14,32,North and south sides of Ocean Promenade at Beach 116th Street entrance,Y,"October 22, 1981",ca. 1981,Three-wall mosaic with plaque on west wall,"First wall 3'4"" x 3'; Second wall 1'8"" x 3'; third wall 1'8"" x 2'2""",,"145,000 Italian glass and ceramic tiles set into concrete",,Cityarts Workshop Mosaic Designs,Ann Evans; Mary Nell Hawke,,United States Department of Housing and Urban Development,,,,,N,,,"$30,000",,,1029812.472511217,149796.38680888712
John Ericsson,"Ericsson, John",454,Y,Manhattan,Battery Park,M005,1,1,Perimeter of park on State Street across from Bridge Street,Y,"August 1, 1903",1903,"Figure (heroic scale) on integral plinth, pedestal with four recessed relief plaques","Figure H: 8'7""; Base H: 7'11"" W: 8' D: 8'; Each plaque H: 1' W: 2'3½""",,Figure--bronze; Pedestal--black diamond granite (polished); Plaques--bronze,"Gorham Manufacturing and Founders (statue); Roman Bronze Works, Inc. (plaques)",,Jonathan Scott Hartley,Frank E. Wallis (new pedestal),State of New York,,,,,Y,,,"$10,000","Civil War, Scientist/Inventor, War Memorial",,980218.5569354743,195631.4696792215
Civic Virtue,Civic Virtue,343,N,Queens,,QZ23,9,29,Beside Queens Borough Hall; Queens Boulevard and Union Turnpike,Y,"1922, 1941",ca. 1922,Male figure (heroic scale) standing over two prone female semi-figures on base inside fountain basin with four dolphin-head spouts below,"Total H: 22'10"" W: 5'7""; Basin diameter: 38'",,White Georgia marble,,Piccirilli Brothers,Frederick William MacMonnies,Thomas Hastings,Bequest of Angelina Crane,,,,,N,,,,Allegorical,,1031435.7920992225,199525.6961427331
Robert F. Wagner Tree Marker,"Wagner, Robert Ferdinand, jr.",1641,N,Manhattan,,M060C,8,4,Madison Avenue between East 60th and East 61st Streets,Y,"June 8, 1961",1960,Plaque set in ground,"H: 11"" x W: 1'4""",,Bronze,,,,,Albert and Mary Lasker Foundation,,,,,N,,,,Politcal Figure,,992325.4815404713,217832.79962031543
The Immigrants,"Immigrants, The",765,Y,Manhattan,Battery Park,M005,1,1,South of Castle Clinton,Y,"May 4, 1983; Rededicated August 1, 2005",1973,Group (heroic scale) on base,"Group H: 10' W: 5' D: 14'2½""; Base H: 1'1"" W: 8' D: 17'7""",,"Bronze, Minnesota Rideau Red granite",Modern Art Foundry,A. Ottavino Corp. (base),Luis Sanguino,"Frank Luzi, P.E./P.C.",Samuel and May Rudin; Rudin Management Company,,,,,Y,,,,Immigration,,979708.6288214773,195437.3719703108
Rose and Crown Tavern,,1379,Y,Staten Island,,Z004B,2,50,"Richmond Rd., New Dorp Lane",Y,c. 1921,,Tablet on boulder,"Tablet H: 18"" W: 22""; Boulder H: 4' W: 3' D: 3'",,"Bronze, natural boulder","Eagle-Heath Bronze Corp., Mt. Vernon, NY",,,,Richmond County D.A.R.,,,General William Howe,,Y,,,,"Revolutionary War, War Memorial",,950928.9849373102,149033.54745531082
harriman panels,,683,N,Manhattan,,,0,0,,M,,,,,,,,,,,,,,,,,,,,,,,
Civic Pride,,257,N,Manhattan,,,1,1,"MUNICIPAL BUILDING; Chambers and Center Streets, arch south side",Y,1912,,panel relief,,,Maine granite,,,Adolph Alexander Weinman,,purchase,,,,,,,,,Sculpture,,,
Theodore Roosevelt,,1375,Y,Manhattan,Theodore Roosevelt Park,M053,7,6,"American Museum of Natural History, CPW and 79th St",Y,1940,,Equestrian group,,,"Bronze, Conway green granite",,,James Earle Fraser,John Russell Pope,Gift of the State of New York,,,,,Y,,,,,,991783.8274400532,223761.0016746372
Poetry,,1197,O,Manhattan,Bryant Park,M008,5,3,New York Public Library; 42nd St. and 5th Avenue,Y,1915,,statue,,,,,,Paul Wayland Bartlett,,purchase  $4200.,,,,,,,,,,,,
Electricity,Electricity,443,N,Manhattan,,,1,1,"Surrogate's Court/Hall of Records, 31 Chambers Street, Reade Street elevation, chief cornice, second from left",Y,1905,ca. 1905,female figure (heroic scale),,,Westerly granite,,,Philip Martiny,Horgan and Slattery,"$75,000 (total for all 47 sculptures originally in and on Surrogate's Court/Hall of Records); purchase",,,,,,,,,,,,
Netherland Monument,Netherland Memorial,1092,Y,Manhattan,Battery Park,M005,1,1,Northeast entrance near intersection of State Street and Battery Place,Y,"December 6, 1926",1926,Sculpted flagstaff pedestal,"Total H: 12'; Top W: 2'6"" D: 2'6""; Bottom W: 7' D: 7'",CPF Endowment,"Bencha granite, bronze",,,H.A. Van den Eyden,,People of the Netherlands,,,,,Y,,,,Colonial,,980204.185245052,195909.0914993137
"loomis, alfred lebbens",,937,N,Manhattan,,,6,4,BELLEVUE HOSPITAL; foot of e. 26th st.,Y,,,tablet,,,,,,,,gift,,,,,,,,,,,,
seaman's institute,,1421,Y,Manhattan,,,1,1,SOUTH ST. & COENTIES SLIP; lighthouse moved to south street seaport,N,"March, 1913",,tablet,,,bronze,,,,,seaman's inst/ publ. subscrptn,,,,,,,,,,,,
Large Coqui,,2078,Y,Manhattan,,M116,3,1,Houston Street and Essex Street; northwest corner of playground.,Y,"Oct. 19, 2007",2004,Figural sculpture of a mother and baby coqui frog,"40"" x 76"" x 88""",,Bronze,"Beacon Fine Art Foundry, Beacon, NY","Insun Kim, Beacon Fine Art Foundry, Beacon, NY",Tom Otterness,,Tom Otterness,,,,,Y,10/11/2007,,"$300,000",,,988072.3033670485,202306.05409905314
Erasmus Hall High School,,448,N,Brooklyn,,,14,40,ERASMUS HALL HIGH SCHOOL; Flatbush and Church Avenues,Y,1930,,tablet panel,,,carved oak,,,Adam Dobowski,,gift,,,,,,,,,,,,
Sugar House Prison Window,,1519,N,Manhattan,,,1,1,MALL BETWN POLICE HQ&MUN BLDG; centre st.,Y,"1968, orig. 1763",,artifact window in contemporary frame,,,"brick concrete, holland brick and",,,"stone work, iron bars, brnz pl",,purchase,,,,,,,,,,,,
Norwegian Veterans Monument,Norwegian Maritime Monument,1123,Y,Manhattan,Battery Park,M005,1,1,Northwest of Castle Clinton,Y,"October 21, 1982",ca. 1982,"Small boulder with incised anchor motif, atop large inscribed boulder, inscribed marker","Total H: 6' W: 12'; Marker front H: 4"" Rear H: 1'2"" W: 1'8"" D: 1'4""",CPF Endowment,Norwegian coastal boulders; marker--pink granite,,A. Ottavino Corp.,,,Norwegian war veterans,Y,"$6,400 contributed by Norwegian war veterans to maintenance endowment with City Parks Foundation",,,Y,,,,"World War II, War Memorial",,979444.7182600498,195681.15954047441
Battery Park Cannon,Battery Park Cannon,88,Y,Manhattan,Battery Park,M005,1,1,Perimeter of park on State Street between Bridge and Pearl Streets,Y,1914,ca. 1914,"Cannon on base, plaque","H: 2'9"" W: 4' D: 1'2""",,Cannon--iron; base--granite; plaque--aluminum,,,,J.V. & R.V. Lamb,William Henry Mairs; Children of the City History Club,,,Revolutionary War Cannon,,Y,,,,"War Memorial, Revolutionary War",,980226.0487183928,195666.44434681535
Sunset Park Memorial,Sunset Park Memorial,1529,Y,Brooklyn,Sunset Park,B087,7,38,,N,"November, 1927",1927,plaque on boulder at the head of a flight of steps,total h 4',,"bronze, granite",,,Charles W. Tandy,Dieges & Christ (?),"$1, 500",,,,,,,,,"War Memorial, World War I",,,
public school #114,,1244,N,Brooklyn,,,0,0,,Y,,,,,,,,,,,,,,,,,,,,,,,
stanford bust,,1496,N,Manhattan,,,0,0,PALO ALTO CALIFORNIA; stanford university -1942,M,,,,,,,,,,,,,,,,,,,,,,,
"southerland, benjamin delamater",,1473,N,Manhattan,,,2,3,P.S. #3; hudson and grove Streets,Y,1917,,tablet,,,bronze,,,Charles Keck,,gift. $1000.,,,,,,,,,,,,
Battery Park Cannon,Battery Park Cannon,88,Y,Manhattan,Battery Park,M005,1,1,Perimeter of park on State Street between Bridge and Pearl Streets,Y,1914,ca. 1914,"Cannon on base, plaque","H: 2'9"" W: 4' D: 1'2""",,Cannon--iron; base--granite; plaque--aluminum,,,,J.V. & R.V. Lamb,William Henry Mairs; Children of the City History Club,,,Revolutionary War Cannon,,Y,,,,"War Memorial, Revolutionary War",,980226.0487183928,195666.44434681535
Peter Caesar Alberti Marker,"Alberti, Peter Caesar",12,Y,Manhattan,Battery Park,M005,1,1,Perimeter of park on Battery Place between Greenwich and Washington Streets,Y,"Original: June 2, 1958; rededicated ca. 1985",ca. 1985 (replica),Marker on plinth,"Front H: 4""; Rear H: 1'2"" W: 1'8"" D: 1'4"" (all approximate)",,Granite,,A. Ottavino Corp.,,,Italian Historical Society of America (original),,,,,Y,,,,Immigration,,979744.5565711409,196001.71237705648
Recorder,Recorder,1315,N,Manhattan,,,1,1,"Surrogate's Court/Hall of Records, 31 Chambers Street, Centre Street façade, beside center window in attic",Y,1903,ca. 1903,half-reclining male figure (heroic scale),,,Westerly granite,,,Henry Kirke Bush-Brown,Horgan and Slattery,"$75,000 (total for all 47 sculptures originally in and on Surrogate's Court/Hall of Records); purchase",,,,,,,,,,,,
Isham Park Benches,,2097,Y,Manhattan,,M043,12,7,Broadway and 212th Street,Y,,,"Four benches, two are engraved",,,Granite,,,,,,,,,,Y,,,,,,1006759.3693393022,255776.74112072587
McCarren Park World War I Memorial,,996,Y,Brooklyn,McCarren Park,B058,1,33,MCNULTY SQUARE; Union and Driggs Aves.,N,"5/27/23, plaque 10/10/26",,"iron cannon, brnz tablet - scrap 1942",,,"iron, bronze",,,,,"t.r. mcnulty post, #452 amer legion",,,,,,,,,"War Memorial, World War I",,,
Electrolier,electrolier,444,Y,Manhattan,,,0,0,,N,,,,,,,,,,,,,,,,,,,,,,,
