name,fileorder,number,parkprop,borough,parkname,parknumber,commboard,council,Location,extant,dedicated,cast,descrip,dimen,sponsor,materials,foundry,fabricator,sculptor,architect,donor,maintain,contractor,Name2,Name3,MaintainedByParks,Installation,Rededication,Cost,Categories,inscribed,X,Y
Catholic War Veterans Square,catholic war veterans square,221,Y,Queens,Catholic War Veterans Square,Q148,10,28,"Rockaway Blvd., 122nd St., 112 Avenue",Y,,,Carved cross on base,,,"Granite, concrete",,,,,,,,,,Y,,,,War Memorial,,1035223.4931852221,185583.0199598968
Peter & Willie,Peter and Willie,1915,Y,Brooklyn,Prospect Park,B073,0,39,"Imagination Playground, Ocean Avenue and Lincoln Road",Y,"June 20, 1997",1997,"Two figures and chair on a natural boulder, mosaic play surface",boulder = approx. w. 9' x d. 4',,Figures--bronze; boulder--basalt; play surface--ceramic,"Bedi-Makky Art Foundry, 227 India Street Greenpoint, Brooklyn",,Otto Neals,,Ezra Jack Keats Foundation (sculpture only),,,,,Y,,,"$800,000 (entire playground);",,,994516.1881170571,179199.2781342268
Thomas F. Smith,"Smith, Thomas F.",1457,N,Manhattan,Thomas F. Smith Park,M084,4,3,Eleventh Avenue at 23rd Street.,Y,1924,1924,Stele,H: 8' W: 3' D: 3',,Deer Isle granite,,George A. Fuller Co.,,,Seymour Club of Chelsea,,,,,,,,"$3,000",Politcal Figure,,982216.2465096414,212058.6632027328
City Hall Park Fountain,City Hall Park Fountain,350,Y,Manhattan,City Hall Park,M013,1,1,South end,Y,"Rededicated October 7, 1999",1872,"Square pool with candelabrum at each corner; central column consisting of circular basin with umbrella above, surmounted by fixture",Pool L: 30' W: 30'; Basin Diameter: 10'; Column H: 15' (all approximate),Delacorte CPC,"Pool and column (except for fixture)--granite; Candelabra, fixture--bronze",,,,Jacob Wrey Mould,Purchase,,,Mould Fountain,,Y,,,,,,982267.9002777189,198736.58781281114
Beach and Sea Lion,Beach and Sea Lion,1837,Y,the Bronx,Crotona Park,X010,3,15,Crotona Pool Bath House,Y,ca. 1936,ca. 1936,Bas-relief roundel,,,Stone,,,Frederick George Richard Roth,,,,,,,,,,,,,1012513.1531073004,245266.7805133909
Voice 2,,2042,Y,Manhattan,,M376,9,7,"Hudson River, between 125th and 135th Sts., West Harlem Pier Park",Y,"May 30, 2009",2008,"Sculpture representing casting loop on fishing poles, tilted slightly to the ground",,Percent For Art,Stainless steel,"Soapstone Studios, Brooklyn, NY","Soapstone Studios, Brooklyn, NY",Nari Ward,,,,,,,Y,06/01/2008,,,,,995088.5032453835,237771.5822492242
Medusa,Medusa,1838,Y,the Bronx,Crotona Park,X010,3,15,Crotona Pool Bath House,Y,ca. 1936,ca. 1936,Bas-relief roundel,,,Stone,,,Frederick George Richard Roth,,,,,,,,,,,,,1012503.6252392232,245238.19658106565
General Gouverneur Kemble Warren,"Warren, Gouverneur Kemble",1648,Y,Brooklyn,Grand Army Plaza,B040,19,33,West of the Arch on sidewalk near Union Street,Y,"June 26, 1896",1893,"Standing figure (over life-size) on pedestal, two plaques","Overall dimensions H: 17'6"" W: 8' D: 8'",,"Bronze, Conway green granite",Henry-Bonnard Bronze Co. New York,,Henry Baerer,,"G.K.Warren Post #286 , N.Y. Department of the G.A.R.",,,,,Y,,,"$10,000","Soldier, Civil War, War Memorial",,992390.3035892993,184474.7452735603
Union Square Park Labor & History Plaques,,2100,Y,Manhattan,,M089,5,2,Around perimeter sidewalks,Y,2002,,A series of 22 plaques set into the sidewalks surrounding park,,,Bronze,,,Gregg LeFevre,,,,,,,Y,,,,,,986732.1757979691,207329.7323718965
Neptune Fountain,Neptune Fountain,1761,Y,Staten Island,Sailors Snug Harbor,R116,1,49,East Lawn,Y,1893 (original); 1994,ca. 1994,Male figure (heroic scale) atop basin; original zinc figure is Visitor's Center,"Total H: 10'6""; basin Diameter: 60'",MAS,Figure--bronze; basin--cast iron,Modern Art Foundry,Modern Art Foundry,,Quennell Rothschild Associates,,,,,,Y,,,"$620,350 (bronze reproduction)",,,956279.4115723819,174032.79699739814
General Franz Sigel,"Sigel, Franz",1447,Y,Manhattan,Riverside Park,M071,7,6,Riverside Drive and West 106th  Street,Y,"October , 1907",1907,Equestrian figure (over life-size) with integral plinth on a pedestal that rests on a base that allows the monument to sit at the top of a staircase,"Figure H: 11'9""; Pedestal H: 6'3"" L: 10' W: 5'8""; base H: 2'3"" L: 10' W: 5'8""",Riverside Park Fund,"Bronze, Plymouth granite",,,Karl Bitter,William Welles Bosworth,Sigel Monument Association,,,,,Y,,,"$20,000","War Memorial, Sculpture, Soldier, Civil War, Animal: equestrian",,992531.5306690484,231575.79870906472
The Navy: American Sailors At Sea Urged On By the Genius of Patriotism,"Navy, The: American Sailors At Sea Urged On By the Genius of Patriotism",1090,Y,Brooklyn,Grand Army Plaza,B040,19,33,"Soldiers and Sailors Memorial Arch, south façade, east pier",Y,1901,1901,Group in high relief on platform,"H: 22'3"" W: 11'3¾"" D: 7'5½""",,Bronze,"Thiebaut  Freres, Paris; Henry-Bonnard Company, New York",,Frederick William MacMonnies,Stanford White,City of Brooklyn,,,,,Y,,,,"Civil War, Sculpture, War Memorial",,992634.9438480586,184455.21578505635
Mowgli Skins the Tiger,Mowgli Skins the Tiger,1830,O,Brooklyn,Prospect Park,B073,0,39,"Prospect Park Zoo; Flatbush Avenue entrance, west side of southern kiosk",Y,1935,1935,Bas-relief,,,,,,Wilhelm Hunt Diederich,Aymar Embury II,,,,,,,,,,,,994102.7266736329,181802.99602389336
General Henry Warner Slocum,"Slocum, Henry Warner",1454,Y,Brooklyn,Prospect Park,B073,0,39,"East Plaza Street, east of Soldiers and Sailors Memorial Arch",Y,"May 30, 1905",ca. 1905,"Equestrian figure on pedestal embellished with relief eagle on front, four medallions (two on each side)","Statue H: 17' W: 4'8¾"" D: 12'7¾""; Pedestal H: 11'10¾"" W: 10'5¾"" D: 18'4""",MAS,"Figure, eagle, and medallions--bronze; pedestal--pink Milford granite with steps of Milford granite alternating with Green's Landing granite",E. Gruet,,Frederick William MacMonnies,Stanford White,Brooklyn City Legislature,,,,,Y,,,29000.00,"Civil War, War Memorial",,992813.8417842239,184627.99923214316
Bound Hands Rising Free,Bound Hands Rising Free,1907,Y,Brooklyn,McCarren Park,B058,1,33,Father Jerzy Popieluszko Square; Bedford and Nassau Avenues,Y,"May, 2000","January, 2000","A hand pointing down supports a group of three hands pointing upward with the higher, middle hand supporting a dove with wings spread and starting to fly, on a pedestal","Sculpture H: 3'9"" W: 9""; pedestal H: 2' W: 1' D: 1'",,Bronze; granite,"Modern Art Foundry, Inc., Long Island City, NY",,Thomas Cleveland,,DPR: Capital projects,,,,,Y,,,,,,997351.2716857195,202646.6331423074
Heinrich Heine Fountain,Heinrich Heine Fountain,700,Y,the Bronx,Joyce Kilmer Park,X028,4,17,At southern end of park,Y,"July 8, 1899",ca 1888,"Seated figure (over life-size) on pedestal with bas-reliefs; three lounging figures below, in a large basin; tablet nearby","Total H: 19'; Basin Diameter: 34'6""",MAS/SF,"Tyrolean marble, Dover marble, bronze, granite",,,Ernst Herter,,"Arion, a German-American singing society",,,Lorelei Fountain,,Y,,07/08/1999,"$35,000",,,1005507.6621970534,240764.94929397106
Seat,Seat,1423,Y,the Bronx,Owen F. Dolen Golden Age Center,X016,9,13,"East Tremont Lane and Westchester Avenue; Westchester Square, facing Benson Street",Y,"October 20, 1987",ca. 1987,"Armchair mounted with open dictionary underneath, on engraved boulder","Armchair H: 4'5"" W: 2'5"" D: 2'6""; Boulder H: 4' W: 6'8"" L: 8'8""",,"Chair and dictionary--bronze (light blue-green patina); Boulder--Stony Creek, Connecticut pink granite","Art Foundry, Santa Fe, NM",,David Saunders,,"Public Art Fund; Samuel and May Rudin Foundation; John J. Reynolds, Inc., Con Edison, NYC Department of Cultural Affairs, Bronx Borough President's Office, NYC Council On the Arts, and National Endowment for the Arts",,,,,Y,,,"40,000.00",,,1027737.4012020528,245477.80502572656
Ibis Totem,Ibis Totem,1899,Y,the Bronx,Crotona Park,X010,3,15,Crotona Pool Bath House façade,Y,ca. 1936,ca. 1936,2 vertical bas reliefs on exterior of building,h 10' (approximate),,Stone,,,Frederick George Richard Roth,,,,,,,,,,,,,1012541.7370396405,245314.42018190026
Robert Fulton,"Fulton, Robert",1905,Y,Brooklyn,Fulton Park,B038,3,36,Schenectady Avenue and Fulton Street,Y,1955,1955,Standing figure (heroic scale) on integral plinth on pedestal,"Figure H: 10'6""; pedestal H: 4'6"" W: 5'3"" D: 5'3""",,"Figure--bronze, pedestal facing--dark Quincy granite (polished)","Roman Bronze Works, Inc.;",,Caspar Buberl,,,,,,,Y,,,,Scientist/Inventor,,1002867.4762044698,186936.9644304812
Crack Is Wack,Crack Is Wack,1801,Y,Manhattan,Crack Is Wack Playground,M208E,11,8,"E 128 ST, 2 AVE & HARLEM RIVER DRIVE",Y,1986,1986,Two murals on either side of concrete handball wall,,,Paint,,Keith Haring (artist),,,Keith Haring,,,,,Y,,,,,,1003119.9642165601,232466.2427943051
First Symphony of the Sea,First Symphony of the Sea,1797,Y,Brooklyn,Coney Island Beach,B169,13,47,Riegelmann Boardwalk / Louis Valentino Jr. Way,Y,"June 26, 1993",1992,Mural on free-standing wall,H: 10' L: 332',,"Terrazzo, ceramic, and concrete",,,Toshio Sasaki,Goldstone & Hinz,"Percent for Art, New York City Department of Cultural Affairs",,,,,Y,,,,,,991043.8387625515,148300.21755714715
Soldiers and Sailors Monument,Soldiers and Sailors Monument,1464,Y,Queens,Major John W. Mark Park,Q025,12,27,173rd Street and Hillside,Y,1896,1896,"Standing angel figure (over life-size) holding a laurel wreath in her left hand and a palm bough in her right,, on integral plinth on pedestal","Figure H: 10'9""; Pedestal H: 10' W: 3'6"" D: 3'6""",MAS,Bronze; Westerly granite,,,Frederick Wellington Ruckstull,,,,,,,Y,,,,"Civil War, War Memorial, Allegorical",,1042872.5133202225,198629.99845905602
G.A.R. Tablet,,568,Y,Brooklyn,Grand Army Plaza,B040,19,33,,M,1925,,Tablet on plinth,"H: 11"" W: 4' D: 3'1""",,"Bronze, granite",,,,,,,,Grand Army Tablet,,,,,,"Civil War, War Memorial",,,
Grant's Tomb Eagles,,616,N,Manhattan,Riverside Park,M071,7,6,122nd St.,Y,,,2 eagles,,,granite,,,,,,,,,,,,,,,,994413.9301194698,235563.0338448137
Speeder,Speeder,1841,Y,the Bronx,Crotona Park,X010,3,15,Crotona Pool Bath House,Y,ca. 1936,ca. 1936,Bas-relief roundel,,,Stone,,,Frederick George Richard Roth,,,,,,,,,,,,,1012465.5134388059,245171.5008483082
World's Fair Flagstaffs,,490,Y,Queens,Flushing Meadows / Corona Park,Q099,15,21,,Y,,,"2 flagstaffs, eagle finials on base",,,Granite,,,,,,,,,,Y,,,,,,1028771.929972887,212170.96940855682
Marie Sklodowska Curie,"curie, marie sklodowska",359,Y,Manhattan,City Hall Park,M013,1,1,,Y,1934,,Tablet on plinth,"H: 9"" W: 13""",,"Bronze, granite",,,,,Gift of American Polish Children,,,,,Y,,,,Abstract,,982271.6332098842,198953.23895430565
Charging Bull,Charging Bull,1750,N,Manhattan,Bowling Green,M007,1,1,"Broadway, center island north of Bowling Green",Y,December 1989,ca. 1989,Volumetric figure,"h 8' x l 16'; weight: 7,000 pounds",,Bronze,Bedi-Makky Art Foundry,,Arturo DiModica,,,,,,,Y  Y,12/01/1989,,,,,980522.6091488898,196334.8859233111
Firemen's Memorial Luminaire,,1986,Y,Manhattan,,M097,7,6,Broadway and West 72nd Street,Y,,,"Decorative lamppost, with some original parts taken from a lamppost that was originally located at the Firemen's Memorial at Riverside Park",,,Bronze,,,,,,,,Goat Head Torchiere,,Y,,,,,,989238.4066778868,222859.69803105295
Frank J. Goodwin,,597,Y,Manhattan,Chelsea Park,M011,4,3,9th Avenue at 27th Street,Y,1926,,Memorial gate posts,"H: 5'10"" W: 2' D: 2'",,North Jay granite,,,,Murry and Matheson,Horatio Seymour Tammany Club,,,,,Y,,,,"Public Servant, Politcal Figure",,984429.9664916396,212360.82992123067
Marine Amphitheater Groups,Marine Amphitheater Groups,32,Y,Queens,Flushing Meadows / Corona Park,Q099,15,21,Ederle Terrace Concession Building,Y,1939,ca. 1939,"Three panels; two with figures of music and dance, third is of the 'Aquacade'",Each group H: 3' W: 6',,Cast stone and imitation limestone,,,,Sloan & Robertson,New York State (acquired by City in 1940),,,,,Y,,,,,,1028102.5602486432,208588.25347688794
Fort Tryon Park Flagstaff,,535,Y,Manhattan,Fort Tryon Park,M029,12,7,"Linden Terrace,  Riverside Drive and 192nd Street to Dyckman Street",Y,1939,,Flagstaff pedestal,"H: 8'8"" D: 13'",,"Deer Isle granite, bronze","T.F. McGann and Sons, Boston, MA",,,,,,,,,Y,,,,Revolutionary War,,1002793.623005718,253269.85669881105
Mowgli Protected from the Tiger by the Wolves,Mowgli Protected from the Tiger by the Wolves,1827,O,Brooklyn,Prospect Park,B073,0,39,"Prospect Park Zoo; Flatbush Avenue entrance, north side of northern kiosk",Y,1935,1935,Bas-relief,,,,,,Wilhelm Hunt Diederich,Aymar Embury II,,,,,,,,,,,,994084.490161553,181858.38042755425
Ukrainian American Flagstaff,,1588,Y,Manhattan,Triangle at East 10th Street and Stuyvesant Place,M188,3,2,Stuyvesant and 10th Sts. at 2nd Avenue,Y,7/4/44,,,,,Maine and Chelmsford grey granite,,,,John Koggins (DPR),Ukranian-Americans,,,,,Y,,,,"World War II, War Memorial",,987882.5724473,205211.47906248271
Skagerrak,Skagerrak,1450,Y,Manhattan,Bellevue South Park,M263,6,2,"East 26th Street to East 28th Street, and 2nd Avenue",Y,1971,ca. 1971,"Three solid rectangular forms, joined at different angles in a line, and balanced on three points",H: 7'  W: 7'  D: 16',,Cor-ten steel,,,Antoni H. Milkowski,,Association for a Better New York,,,,,Y,,,,Sculpture,,990425.6897363812,208981.5607611388
Blockhouse Plaque,Blockhouse Plaque,124,Y,Manhattan,Morningside Park,M056,9,9,MORNINGSIDE PARK; Morningside Ave. at 123rd St.,M,1904,,plaque,,,"bronze, granite",j. & r. lamb,,,,"gift, $80.",,,,,,,,,"War Memorial, War of 1812",,995584.8966095597,232921.25271105766
World's Fair Flagstaffs,,490,Y,Queens,Flushing Meadows / Corona Park,Q099,15,21,,Y,,,"2 flagstaffs, eagle finials on base",,,Granite,,,,,,,,,,Y,,,,,,1028931.7692201436,211811.68928723037
Doric Columns,Doric Columns,1917,Y,Queens,Athens Square Park,Q436,1,22,facing sunken plaza,Y,1996,ca. 1996,Three fluted columns supporting a curved entablature,"Total H: 28'3"" W: 20' (both approximate)",,Granite,,,,"Stamatios P. Lykos, AIA, ASLA","Athens Square, Inc.",,,,,Y,,,"$170,000 (architect's estimate);",,,1005779.9605369717,219010.7615032196
Unisphere and Fountain,,1597,Y,Queens,Flushing Meadows / Corona Park,Q099,15,21,,Y,"March 6,1964",,"Spherical world globe, topographical relief, fountain",H: 140' W: 120',,"Stainless steel cage, steel mesh, granite, colored lights (originally)",,,,Gilmore D. Clarke,USS Steel Corporation; World's Fair Corporation,,,,,Y,,,,,,1027165.4085796326,211252.100511387
Giuseppe Verdi,,1624,Y,Manhattan,Verdi Square,M097,7,6,Broadway at 73rd Street,Y,"October 11, 1906",,"Statues on ped., surrounding statues","H: 25'9"" Diameter: 18'",CPF Endowment,"Carrara, Monte Chiaro limestone",,,Pasquale Civiletti,,Resident Italians,,,,,Y,,,20000.00,Composer/Musician,,989376.7200495601,223166.25712922215
Wild Geese,Wild Geese,1833,Y,the Bronx,Crotona Park,X010,3,15,Crotona Pool Bath House,Y,ca. 1936,ca. 1936,Bas-relief roundel,,,Stone,,,Frederick George Richard Roth,,,,,,,,,,,,,1012546.5011377186,245343.0041142255
Voice 4,,2043,Y,Manhattan,,M376,9,7,"Hudson River, between 125th and 135th Sts., West Harlem Pier Park",Y,"May 30, 2009",2008,"Sculpture representing casting loop on fishing pole, tilted almost to the ground",,Percent For Art,Stainless steel,"Soapstone Studios, Brooklyn, NY","Soapstone Studios, Brooklyn, NY",Nari Ward,,,,,,,Y,06/01/2008,,,,,994887.6732664704,237467.623539567
Randolph St. G. Walker Jr.,,1645,Y,Staten Island,Randolph Walker Park,R015,1,49,Bard Avenue and Delafied Place,Y,1923,,Tablet on wall,"1'2""h x 2'4 ½""w",,Bronze,,,,,"Randolph Walker Jr. Post #1056, American Legion",,,,,Y,,,,"World War I, War Memorial",,954058.6988222152,173875.63523823023
Stuyvesant Post War Memorial,Stuyvesant Post War Memorial,1595,Y,Manhattan,,,6,2,"Veterans Adminstration Hospital, 423 East 23rd Street",Y,"November 11, 1934",1934,Hexagonal stele with cap; three convex sides separated by three shorter straight sides decorated with swords in bas-relief,"Total H: 10'8"" (stele H: 9', cap H: 1'8"") D: 6'6""",,"Stele-- Indiana(""French"") limestone; cap --  black diamond granite",,,Wilhelm Hunt Diederich,Aymar Embury II,"Stuyvesant Post, Veterans of Foreign Wars",Y,"Draft agreement with Veterans Administration, 99-year revocable loan, 1996; VA reponsible for maintenance",Union Square Memorial,,Y,,,"$2,800","War Memorial, World War I",,990466.904220894,207650.06112755835
Kryeti-Aekyad #2,Kryeti-Aekyad Number 2,1767,Y,Manhattan,John Jay Park,M045,8,5,East 76-78th Streets and Cherokee Place,Y,October 1979,ca. 1979,Precariously balanced pieces of steel,"H: 7'7"" W: 10'11"" D: 1'10"" (all approximate)",& Agency (est. by John Jay Park Association),Welded hot-rolled steel (painted black),,,Douglas Abdell,Thomas Balsley Associates,Rosenstiel Foundation,,,,,Y,,,"$65,000",Sculpture,,998077.6773851365,219550.45005638897
Quadriga: the Triumphal Progress of Columbia,Quadriga: the Triumphal Progress of Columbia,1632,Y,Brooklyn,Grand Army Plaza,B040,19,33,Atop Soldiers and Sailors Memorial Arch,Y,1898,ca. 1898,Quadriga and three female figures (heroic scale),H: 25' W: 32' D: 16'; each trumpeter H: 11',,Bronze,LeBlanc Barbedienne,,Frederick William MacMonnies,Stanford White,City of Brooklyn,,,Victory,,Y,,,"$42,000","Civil War, War Memorial, Animal: equestrian, Allegorical",,992605.7516492158,184471.75807480514
Flying Fish,Flying Fish,1843,Y,the Bronx,Crotona Park,X010,3,15,Crotona Pool Bath House,Y,ca. 1936,ca. 1936,Bas-relief roundel,,USTA Fund,Stone,,,Frederick George Richard Roth,,,,,,,,,,,,,1012498.8611411303,245176.26461830735
Etched Granite Pavement,Etched Granite Pavement,1775,Y,Queens,Flushing Meadows / Corona Park,Q099,15,21,Just east of the Unisphere,Y,1995,ca. 1994,"Four hundred sixty-four square, smooth, inset blocks arranged in four groups","Two groups 24' x 40'; two groups 8' x 45'; total area: 3,000 square feet",,Black granite,,,Matt Mulligan,Miceli Kulik Williams,Percent for Art,,,,,Y,,,"$400,000",,,1027409.2414253056,211345.52125631273
Grand Army Plaza Lamps,,609,Y,Brooklyn,Grand Army Plaza,B040,19,33,Plaza entrance,Y,,,Lamps,,,Bronze,W & J Lamb Co.,,,,,,,,,,,,,,,992581.5397553891,184404.7755972296
Macombs Dam Park Fountain,,955,Y,the Bronx,Macombs Dam Park,X030,4,17,Triangle opposite Macombs Dam Park; Jerome Avenue at 162 Street and Ogden Avenue,Y,1908,,Display fountain,"H: 7'8"" W: 17'4"" D: 10'3""",,Upper portion--Indiana limestone; Base and basin--Stony Creek granite,,,,Martin Schenk and Arthur Waldregon,Purchase,,,,,Y,,,,,,995769.4385633022,225467.27450880408
Roosevelt Island Lighthouse,,1373,O,Manhattan,,,8,5,North tip of island,Y,mid 1800's,,Lighthouse,,,Granite,,John Mc Carthy,,,,,,,,,,,,,,1000815.3891013116,220846.00783272088
Sport Fish,Sport Fish,1845,Y,the Bronx,Crotona Park,X010,3,15,Crotona Pool Bath House,Y,ca. 1936,ca. 1936,Bas-relief roundel,,,Stone,,,Frederick George Richard Roth,,,,,,,,,,,,,1012517.9172053933,245247.7244491428
Fort Tryon Park Playground,,536,Y,Manhattan,Fort Tryon Park,M029,12,7,"Fort Washington Avenue, 191st Street",Y,1942,,Tablet,"H: 1'3 3/8"" W: 2'6"" D: 4""",,Granite,,,,Henry Deacy,Gift of John D. Rockefeller,,,Anne Loftus Playground Plaque,,Y,,,,,,1002491.8378481418,252184.5435807258
Algernon Sidney Sullivan,,1521,Y,the Bronx,Van Cortlandt Park,X092,13,11,Boat House,Y,1906,,Stele with fountain bases,"H: 10'2""  W: 4'3"" D: 4'6""",,"Deer Island granite, bronze",,,Jonathan Scott Hartly,Frank E. Wallis,Citizens of New York,,,,,Y,,,6000.00,Politcal Figure,,1013843.2675730586,263187.5130445659
George Washington Accompanied by Fame and Valor,"Washington, George",1668,Y,Manhattan,Washington Square Park,M098,2,1,"Washington Square Arch, east pier, north side",Y,1916,1916,"Standing figure (three/quarters round, over life-size) before two figures (over life-size) in high relief, on integral plinth, pedestal",,,Granite,,,Hermon Atkins MacNeil,,Washington Arch Committee,,,,,Y,,,"$15,000","Revolutionary War, War Memorial, US President",,985082.0101350546,205682.50764797628
Flanders Field Flagstaff,,494,Y,Queens,Linden Park,Q026,4,21,"42 Avenue, 103 Street, 41 Avenue, 104 Street, Corona",Y,,,Flagstaff and tablet on base,,,"Bronze, granite",,,,,,,,,,Y,,,,"World War I, War Memorial",,1022570.5368638933,212111.19689030945
River That Flows Two Ways,,1906,Y,Manhattan,Battery Park,M005,1,1,"Admiral Dewey Promenade, harborside perimeter railing",Y,"June 5, 2000",2000,"Thirty-seven pierced panels, forming a railing for a seawall",each panel 2' x 2'; fence l 1500',,Panels--cast iron; two panels--glass; two running bands--bronze,,,Wopo Holup,,Conervancy for Historic Battery Park,,,,,Y,,,,,,979494.8260994703,195288.28073306382
Riverside Civil War Cannons,,2038,Y,Manhattan,,M072,7,6,Soldiers and Sailors Plaza,Y,,1865,Three cannons,"Diameter: 8"" Length:121"",  Across face of muzzle: 13""",,bronze,"Seyfert, McManus & Co",,,,,,,,,Y,,,,,,990018.4628605545,227810.26096455753
Abraham Lincoln,"Lincoln, Abraham",913,Y,Manhattan,Union Square Park,M089,5,2,North end,Y,"September 16, 1870",1870,Standing figure (over life-size) with integral plinth on pedestal,Figure H: 8'; Pedestal H: 11½'  W: 9½' D: 9½',T&A,"Bronze, Dix Island, ME granite",,,Henry Kirke Brown,,"Public subscription, sponsored by the Union League Club",,,,,Y,,,,US President,,986988.8777123839,207499.27140289545
"Riverdale, Spuytenduyvil, Kingsbridge Memorial Bell Tower",,1345,Y,the Bronx,,,8,11,Riverdale Avenue at 239th Street,Y,1931,,Belfrey tower and terrace; honor rolls,"H: 50' W: 17'6"" D: 17'6""",,"Bronze, fieldstone, Indiana Limestone",,,,Dwight James Baum,Public subscription,,,,,Y,,,,"World War I, War Memorial",,1009591.5519951433,263266.5703011453
Wingdale,Wingdale,1850,Y,Queens,Major John W. Mark Park,Q025,12,27,173rd Street and Hillside,Y,1973,1971,"Two upright, roughly L-shaped beams, joined head to foot;aperture at the center",H: 4½' W: 4½' L: 12',,"Cor-ten steel, painted red",,,Roger Bolomey,,Association for a Better New York,,,Untitled #1,,Y,,,"$7,500",,,1042749.5522800535,198708.06851288676
American Merchant Mariners Memorial,American Merchant Mariners Memorial,1939,N,Manhattan,Battery Park,M005,1,1,"Breakwater extension, section D",Y,"October 8, 1991",1991,"Three figures on boat, one figure is trying to grasp another figure that is in the water","group h 10'6"" x l 24' x w 8'; pedestal h 6' x l 30' x w 12'",,Figures--bronze; lifeboat--fiber-reinforced concrete; concrete,"TALLIX, Beacon, NY",,Marisol Escobar,,"$250,000; American Merchant Mariners' Memorial, Inc., c/o Joan Samsen Associates; tel. (212) 772-9363",,,,,,,,,"Sculpture, Soldier, War Memorial",,979320.5692301393,195767.995980978
Filter House Ornaments,,478,Y,Manhattan,Hamilton Fish Park,M033,3,2,,Y,,,8 sculptured ornaments,,,Limestone,,,,,,,,,,,,,,,,989456.4958086312,201563.2042068094
Baird Court Dolphin Fountains,Baird Court Dolphin Fountains,71,O,the Bronx,Bronx Park,X002,14,12,Bronx Zoo; terrace between Fountain Circle and Baird Court,Y,ca. 1937 (?),ca. 1937 (?),"two fountains, each consisting of vertical high-relief dolphin in scalloped recess over basin",,,,,,,,,,,,,,,,,,,1017931.3118903935,250114.4443744719
Gates of Life,Gates of Life,574,Y,Queens,Flushing Meadows / Corona Park,Q099,15,21,Entrance to Flushing Meadows / Corona Park Zoo,Y,ca. 1968,ca. 1968,Ornamental gates,"H: 10' (ends), 8'6"" (center) W: 22'",,Bronze,,,Albino Manca,"Clarke and Rapuano, Incorporated",,,,,,Y,,,,,,1025936.0314452201,210380.96183373034
Puerto Rican Sun,Puerto Rican Sun,1288,Y,the Bronx,Fox Playground,X247,2,8,Fox and 156th Streets,Y,"October 16, 1979",1979,Assemblage of upright plates,"H: 22' W: 25'6"" D: 22' at base; Weight: 10,000 pounds",,Cor-ten steel,,Lippincott Inc.,Rafael Ferrer,,Bronx Venture Corporation,,,,,Y,,,,Sculpture,,1012361.4657466412,236316.2784013152
Voice 1,,2041,Y,Manhattan,,M376,9,7,"Hudson River, between 125th and 135th Sts., West Harlem Pier Park",Y,"May 30, 2009",2008,"Sculpture representing casting loop on fishing poles, stands fully upright",,Percent For Art,Stainless steel,"Soapstone Studios, Brooklyn, NY","Soapstone Studios, Brooklyn, NY",Nari Ward (born 1963),,,,,,,Y,06/01/2008,,,,,995248.6246443093,238002.26551489532
Wingdale,Wingdale,1850,Y,Queens,Major John W. Mark Park,Q025,12,27,173rd Street and Hillside,Y,1973,1971,"Two upright, roughly L-shaped beams, joined head to foot;aperture at the center",H: 4½' W: 4½' L: 12',,"Cor-ten steel, painted red",,,Roger Bolomey,,Association for a Better New York,,,Untitled #1,,Y,,,"$7,500",,,954736.5229258835,164609.66590930521
Macombs Dam Park Fountain,,955,Y,the Bronx,Macombs Dam Park,X030,4,17,Triangle opposite Macombs Dam Park; Jerome Avenue at 162 Street and Ogden Avenue,Y,1908,,Display fountain,"H: 7'8"" W: 17'4"" D: 10'3""",,Upper portion--Indiana limestone; Base and basin--Stony Creek granite,,,,Martin Schenk and Arthur Waldregon,Purchase,,,,,Y,,,,,,1003903.0591070503,241764.1779385656
Urns - Prospect Park (16),,1603,Y,Brooklyn,Prospect Park,B073,0,39,Grand Army Plaza entrance,Y,,,,,,Painted cast iron,,,,Stanford White,,,,,,,,,,,,994023.7156767994,179174.01834222674
The Army: Genius of Patriotism Urging American Soldiers On To Victory,"Army, The: Genius of Patriotism Urging American Soldiers On To Victory",52,Y,Brooklyn,Grand Army Plaza,B040,19,33,"Soldiers and Sailors Memorial Arch, south façade, west pier",Y,1900,ca. 1900,Group in high relief on platform,"H: 22' W: 11'3¾"" D: 7'4½""",,Bronze,LeBlanc Barbedienne,,Frederick William MacMonnies,Stanford White,City of Brooklyn,,,Heroes of the War 1963-65,,Y,,,50000.00,"Civil War, War Memorial, Sculpture",,992574.5860291421,184446.2748580575
Armillary Sphere,Armillary Sphere,49,Y,Manhattan,Sutton Parks,M108P,6,5,,Y,ca. 1971,1971,Armillary sphere and sundial on circular pedestal,"Sphere Diameter: 2'6""; Pedestal Diameter: 1'",,"Bronze, cast stone",,Kenneth Lynch & Sons,Albert Stewart,"Ann Butter, Levine & Blumberg","Hugh Trumbull Adams, through Salute to the Seasons Fund for a Better New York",,,,,Y,,,,Sculpture,,994743.180445224,214428.41961805522
