name,fileorder,number,parkprop,borough,parkname,parknumber,commboard,council,Location,extant,dedicated,cast,descrip,dimen,sponsor,materials,foundry,fabricator,sculptor,architect,donor,maintain,contractor,Name2,Name3,MaintainedByParks,Installation,Rededication,Cost,Categories,inscribed,X,Y
Triumph of the Human Spirit,Triumph of the Human Spirit,1909,Y,Manhattan,Foley Square & T. Paine Park,M030,1,1,"Centre, Lafayette and  Worth Streets",Y,"October 12, 2000",2000,"Fountain: circular basin supports a colossal composition consisting of a horizontal member lying across the basin with one end resting against a boulder; the horizontal form supports a tall, vertical form resembling an inverted dagger; plaque",H: exceeds 50'; Weight exceeds 300 tons,,Basin and superstructure--black Canadian granite; plaque--brass,,,Lorenzo Pace,,"Percent for Art, Department of Cultural Affairs",,,,,Y,,,,,,983447.4359763861,199564.38012047112
Confucius,Confucius,318,N,Manhattan,,,3,1,Traffic island at the intersection of the Bowery and Division Street,Y,1976,1976,Standing figure (heroic scale) with integral plinth on pedestal; terrace surrounded by sixteen bollards connected by swag chains,"figure h 8' x diameter 3'8""; plinth h 6½""; pedestal h 8' x w 10' x d 10'; total h 16' (approximate)",,Figure--bronze; pedestal--concrete faced with variegated green Eastern Taiwan marble; terrace and bollards--variegated Eastern Taiwan green marble,Industrial foundry in Hong Kong (?),,Liu Shih,W.S. Chen (original pedestal); Tieh Chi Ho (renovated pedestal),Chinese Consolidated Benevolent Association of New York City; government of the Republic of China (?),,,,,Y,,,"$750,000",,,985050.7372317165,199481.66965597868
Deborah Moody Square,,1054,Y,Brooklyn,Lady Moody Square,B211,15,47,,Y,,,Plaque embedded in plinth,"Tablet H: 9"" W: 12"", Plinth H: 10"" W: 13""",,"Bronze, concrete",,,,,"Charles & Frank Trapani Twins Post No. 4658, V.F.W.",,,,,Y,,,,"World War II, War Memorial",,991337.3811544776,156683.34317931533
Thomas Willet,,1706,N,Manhattan,,,1,1,CITY HALL; corridor to mayor's office,Y,1914,,tablet,,,bronze (?),,,Karl Bitter,,publ. subscr. $175.,,,,,,,,,,,,
"Kennedy, John F. Flagstaff",,855,N,Queens,,,23,23,GLEN OAKS HOUSES.; 75th Ave and 255th St.,Y,"May 29, 1964",,"plaque on plinth, flagstaff","plq: 12""h x 16""w",,"bronze, concrete",,,,,glen oaks maintenance dept.,,,,,,,,,,,,
John Howard Payne,"Payne, John Howard",1163,Y,Brooklyn,Prospect Park,B073,0,39,"ON LOAN TO Home Sweet Home House Museum, East Hampton, NY",L,1873,ca 1873,"Bust on pedestal, plaque","H: 41"" W: 28"" D: 19""",Loan Village of E. Hampton,"Bronze, granite",,,Henry Baerer,,Faust Club of Brooklyn,,,,,,,,"$4,000",Writer,,,
Crime Victims Memorial,Crime Victims Memorial,345,Y,Manhattan,City Hall Park,M013,1,1,Behind City Hall,Y,"April 24, 1991","April 24, 1991",Marker,"Front H: 10""; Rear H: 1' W: 2' D: 1'",,Gray granite,,Michael Lewis,,,National Victim Center,,,,,Y,,,,,,982716.8173588812,198992.06860105693
Fort Number Four,,530,Y,the Bronx,Fort Four Playground,X038,8,14,Reservoir Avenue and University Avenue,Y,1914,,Tablet recessed in stone wall,"H: 30"" W: 42""",,Bronze,Paul E. Cabaret and Co.,,,,Daughters of the Revolution,,,,,Y,,,,"Revolutionary War, War Memorial",,1012256.5000773072,257648.52018556
Callahan-Kelly Post Flagpost,callahan-kelly post flagpost,207,Y,Brooklyn,Eastern Parkway Extension,B030,8,37,"Tuxton and Fulton Streets, Eastern Parkway",M,1941,,Tablet on flagstaff base,"H: 5'4"" W: 2'6"" D: 2'6""",,"Bronze, granite",,,,,Gift of American Legion,,,,,,,,,War Memorial,,,
Forest Park Flagstaff,,514,Y,Queens,Forest Park,Q015,16,30,"Myrtle Avenue, Union Turnpike, Park Lane",M,1925,,Flagstaff and plaque,"Flagstaff H: 69'; Plaque H:15 ¼"" W: 16"" D: ½""",,"Bronze, cast stone",,,,,,,,,,,,,,"World War I, War Memorial",,,
Charles and Edward Steinkamp,,1504,Y,Manhattan,Union Square Park,M089,5,2,UNION SQUARE PARK; 4th Avenue at 14th St.,N,1937,,tablet on plinth - stolen 5/28/76,"Tablet H: 11"" W: 1'2""; Plinth H: 1'2"" W: 1'5"" D: 1'3""",,"bronze, Deer Island granite",,,,,"steinkamp bros. pst #853, v.f.w.",,,,,,,,,"War Memorial, World War I",,,
Bronx Parkway Fountain,Bronx parkway fountain,160,Y,the Bronx,Bronx Park,X002,14,12,In storage at 5Boro,S,1925,,Seat and fountain,"H: 18'4"" W: 60"" D: 4""",,"Flagstone, marble",,,,"Carrere and Hastings, Shreve and Lamb",Gift of Paul Baumgarten,,,Baumgarten Fountain,,,,,2000.00,,,1020630.3212561309,258949.84894773364
Joseph Rodman Drake,"drake, joseph rodman",400,Y,the Bronx,Joseph Rodman Drake Park,X015,2,17,Hunts Point to Longfellow Avenue,Y,1915,,"Monolith on square pedestal, with plaque","H: 8' W: 2' D: 2'; Plaque H: 2' W: 1'3""",,"Bronze, marble",Tiffany Studio,,,,Gift,,,,,,,,,Writer,,1016744.6656416357,234539.7389753908
Dawn of Glory,Dawn of Glory,722,Y,Queens,Highland Park,Q020,5,30,Jamaica Avenue at Cleveland Street,Y,"July 13, 1924",1924,"Standing male figure (heroic scale) with integral plinth on pedestal raised on three steps, tablet","Figure H: 10'; Pedestal H: 5' W: 12' D: 11'; Tablet H: 2'4"" W: 2'6""",,Figure--bronze; Pedestal--Deer Isle granite,"American Art Foundry, New York",,Pietro Montana,,Kings County Chapter of the American Legion.,,,Highland Park War Memorial,,Y,,,,"War Memorial, World War I, Allegorical",,1015688.3019407243,188343.505252555
Brower Park Memorial,Brower Park Memorial,178,Y,Brooklyn,Brower Park,B012,8,36,In storage at 5Boro - outside shop area,S,1919,,Stele,"H: 10'7"" W: 5'3"" D: 3'",,"Limestone, granite",,,,Edwin H. Denby,Albany Heights Memorial Committee,,,Albany Heights War Memorial; Bedford Park War Memorial,,,,,,"War Memorial, World War I",,,
Isham Park,,787,Y,Manhattan,Isham Park,M043,12,7,"ISHAM PARK; seaman ave, isham st, 211th st.",N,1925,,captured german cannon,,,"scrapped for wwii, 1942",,,,,gift,,,,,,,,,"War Memorial, World War I",,,
Theodore A. Havemeyer Lilac Garden,,686,O,the Bronx,Bronx Park,X002,14,12,"New York Botanical Garden; Rose Garden, north stairs",Y,1951,,Plaque recessed in stone,"H: 16"" W: 22""",,Bronze,"International Bronze Tablet Company, Inc., New York",,,,Mrs. Theodore A. Havemeyer,,,,,,,,,,,,
Freedom Tree Marker,Freedom Tree Marker,1848,Y,Manhattan,City Hall Park,M013,1,1,"Broadway, south of driveway entrance",Y,1973,ca. 1973,"Plaque on plinth, set into ground","Plaque H: 7"" W: 1'",,"Bronze, granite",,A. Ottavino Corp.,,,,,,,,Y,,,,"Vietnam War, War Memorial",,982192.6445227265,198928.77443630993
Freedom Tree Marker,"O'Connor, Michael F.",557,Y,Manhattan,Madison Square Park,M052,5,3,North of Madison Square Park Flagstaff,Y,1972,ca. 1972,Plaque recessed in plinth,"Plaque H: 7"" W: 1'",,"Bronze, granite",,A. Ottavino Corp.,,,,,,,,Y,,,,"Vietnam War, War Memorial",,987354.5292120576,209657.28217872977
Fountain of Life,Fountain of Life,155,Y,the Bronx,Bronx Park,X002,14,12,New York Botanical Garden; front of administration building,Y,1905,ca. 1905,"Group (life size) of three figures, two of which are riding horse-like sea creatures and one that rides a porpoise, on a pedestal",,,Group--bronze; Pedestal---Dover marble,Roman Bronze Works,,Carl C. Tefft,,Purchase,,,,,,,,7500.00,,,1016774.231855467,253977.31197680533
Central Hollis Square,central hollis square,223,Y,Queens,Liberty Triangle,QZ039,12,27,"Liberty Blvd., Hillburn Avenue, Farmers Blvd.",M,,,Tablet on boulder,"H: 16"" W: 26""",,Bronze,General Bronze Company,,,,,,,,,,,,,War Memorial,,,
New Dorp World War I Memorial,,1100,Y,Staten Island,Memorial Park at Richmond Road and New Dorp Lane,RZ004,2,51,Richmond Road and New Dorp Lane,Y,,,"Honor roll, cairn-type stele","Tablet H: 36"" W: 25""; Overall H: 74"" W: 42"" D: 32""",,"Natural boulders, concrete, bronze",,,,,"Citizens of New Dorp, Staten Island",,,,,Y,,,,"World War I, War Memorial",,950879.9781455547,149017.70627965033
Lieutenant Colonel Isaac Barre,,1981,Y,Manhattan,,M013,1,1,,Y,1925,,Tablet on plinth,"Tablet H: 2' W: 2'7""; Plinth H: 2'7"" W: 4'4"" D: 1'6""",,Bronze and Barre granite (Vermont),Paul E. Cabaret & Co.,,,,"Gift of Ellen H. Walworth Chapter, Daughters of the American Revolution",,,,,Y,,,400.00,,,982494.8102569729,199072.57040855289
Bristol Basin,Bristol Basin,152,Y,Manhattan,Asser Levy Playground,M164,6,4,"Affixed to bridge, East River Drive at 25th Street",M,1942,,"Tablet, oak tree ?",,,Bronze,,,,,English Speaking Union of the United States,,,,,,,,,,,,
Gracie Mansion,,604,Y,Manhattan,Carl Schurz Park,M081,8,5,Northeast corner of walk surrounding mansion; Not Found 4/06 by J&V,M,1939,,Tablet set in marker,"H: 7"" W: 1'3""",,"Bronze, cement",,,,,British Government,,,,,,,,,,,1000061.5789291412,222088.44399614632
Cespino-Russo Post Plaque,cespino-russo post plaque,227,Y,Staten Island,Franklin D. Roosevelt Boardwalk and Beach,R046,2,50,"Sand Lane and Seaside Blvd., South Beach",Y,,,Tablet on plinth and flagstaff,"Tablet H: 17¾"" W: 12""; Plinth H: 11"" W: 22"" D: 20""",,"Bronze, granite",,,,,"Cespino-Russo Post No. 1544, American Legion",,,,,Y,,,,"World War II, War Memorial",,965849.0823936313,154247.63971740007
Split Rock Tablet,,1485,Y,the Bronx,Pelham Bay Park,X039,0,13,Was in Pelham Bay Park at Prospect Lane; relocated to St. Paul's Church,N,1911,,Tablet,"H: 31"" W: 42""",,Bronze,John Williams Inc.,,,,Gift,,,Anne Hutchinson Memorial,,,,,$250,,,,
Kenneth S. Seewald Memorial,"Seewald, Kenneth S.",1756,Y,the Bronx,Van Cortlandt Park,X092,0,11,Vannie Tennis Courts,M,February 1995,ca. 1995,plaque,"h 1' x w 1'4""",,bronze,,"Matthews Bronze Company, Pittsburgh, PA",,,$320; Mr. Carl Seewald (father),,,,,,,,,"Educator, Athlete",,,
Henry W. Maxwell Memorial,"Maxwell, Henry W.",990,Y,Brooklyn,Grand Army Plaza,B040,19,33,Plaza Street and St. Johns Place,Y,"June 25, 1996",1996,Plaque with bas-relief roundel on boulder. Replica of original which is now at the Brooklyn Museum,"Plaque H: 4'3¼"" W: 3'1½"" D: 1¼""; Boulder H: 8' W: 6'",,"Bronze, granite",,Modern Art Foundry,"Augustus Saint-Gaudens, Albert Jaegers",,David Schwartz Foundation,,,,,Y,,,,Educator,,992876.2169875503,184807.05956956744
Dyckman Municipal Landmark Plaque,Dyckman Municipal Landmark Plaque,421,Y,Manhattan,Dyckman House Museum,M026,12,7,Broadway and West 204th Street,N,"October 8, 1959",ca. 1959,Large rectangular plaque and small circular medallion,"Plaque H: 1'3"" W: 1'11""; Medallion Diameter: 7"" (approximate)",,Aluminum,,,,,The New York Community Trust,,,,,,,,,,,,
Holocaust Memorial,Holocaust Memorial,1770,N,Manhattan,,,5,2,"New York Appellate Court, 25th Street and Madison Avenue, on far bay of 1954 annex",Y,"May 22, 1990",ca. 1990,Fluted marble column with incised relief,"Column H: 3'1"" W: 3' D:1'6""; Pedestal H: 1' W: 5' D: 3'",,Carrara bianco marble,,Walker and Zanger Inc.,Harriet Feigenbaum,,William H. Mulligan,,,,,,,,"$92,100",,,,
Newcomb Fountain,,1112,Y,Manhattan,Cooper Park,M016,3,2,"Cooper Square, 4th Ave and Bowery",N,1894,,fountain - no longer there,"granite, iron",,8'h x 6'w x 1'diam,,,,,marie guise newcomb,,,,,,,,,,,,
"Queens Village, Bellerose Memorial",,1304,Y,Queens,Queens Village Veterans Plaza,Q047,13,27,Jamaica Avenue and Springfield Blvd.,Y,"September 11, 1949",,"Stele, brick walls, coping","H: 104"" W: 6'6"" D: 1'6""; 7""step",,"Barre granite, brick",,,,,Citizens of Queens Village-Bellerose,,,Bellerose World War II Memorial,,Y,,,,"World War II, War Memorial",,1057421.5855999738,200967.6266578138
Croton Aqueduct Descriptive Tablet,,348,N,Manhattan,Bryant Park,M008,5,3,"NEW YORK PUBLIC LIBRARY; 40th Street and 5th Ave, over rm 101.",Y,1842,,tablet,,,marble,,,,,,,,,,,,,,,,989219.9847987145,213661.3397873938
Grand Street Boys War Tablet,,611,Y,Manhattan,,M083,7,6,Broadway at 70th Street,Y,"November 11, 1954",,Tablet on plinth,"H: 1'3"" W: 1'9""",,Bronze and granite,,,,,Grand Street Boys,,,,,Y,,,,"World War II, War Memorial",,989142.3612663001,222486.28572013974
Nobel Monument,,1968,Y,Manhattan,,M053,7,6,Columbus Avenue between West 80-81st Streets,Y,"Oct. 14, 2003",1999,Retangular four-sided stele with attached bronze medallion; engraved with names of American laureates,"H: 11'6""; Medallion Dia: 3'5""",Endowment held by City Parks Foundation (for maintenance and engraving),"Vanga red granite (rough-hewn, Sweden), bronze, Swedish absolute black granite","H. Bergman, Sweden",,A. Lindberg (portrait medallion),Sivert Lindblom,Merck Company Foundation,,,,,Y,,,,,,991116.1309408098,224116.93337747455
Jacob Joffe,,820,Y,Brooklyn,Jacob Joffe Park,B324,18,46,"East 58th-59th Streets, between Avenues J and K",M,1962,,Tablet,"H: 15"" W: 10"" D: ¼""",,Bronze,"U.S. Bronze Sign Company, NY",,,,Friends & neighbors,,,,,,,,,Civic Leader,,,
Milan R. Stefanik,,1501,Y,Manhattan,Tompkins Square Park,M088,3,2,"St. Marks Place, Avenue A",Y,1942,,Bronze plaque on granite base,see memo,,"Bronze, Deer Isle granite",,,,,Slovak Welfare Club,,,,,Y,,,,Soldier,,988988.2024538815,203992.13176363707
"muss, cpl. larry",,1082,N,Queens,,,7,19,"TRIANGLE, FRAN. LEWIS BLVD,; 23rd ave, 163rd st. - highways dept",Y,"May 27, 1962",,inscribed plinth by flagstaff,"10 ½""h x 24""w x 12 ½""d",,"granite, s.b. letters, steel pole",,,,,,,,,,,,,,,,,
Whiting Square Memorial,,1703,Y,Queens,Lieutenant Clinton L. Whiting Square,Q257,9,32,91-52 Avenue at 84th Street,M,1929,,Tablet on natural boulder,"11""h x 1'8""w",,"Bronze, natural boulder",,,Charles Calverly,,"clinton . whiting pst #59, vfw",,,,,,,,,"War Memorial, World War I, All Wars, All Wars",,1023535.1907744706,189832.71126364172
Bowling Green Fence Plaque,Bowling Green Fence Plaque,139,Y,Manhattan,Bowling Green,M007,1,1,"IRON FENCE, BOWLING GREEN; Broadway and Beaver Streets",Y,1964,,Plaque,"H: 18"" W: 23""",,Bronze,,,,,New York Community Trust,,,,,Y,,,,Colonial,,980368.6399686337,196004.03356663883
Hennessy Park World War I Flagstaff,,705,Y,Brooklyn,Heisser Square Park,080B,13,37,Ocean Parkway and Seabreeze Avenue,Y,1925,,Flagstaff base with plaque,"Base H: 44"" W: 40"" D: 40""; Plaque H: 29 7/8"" W: 19 13/16""",,"Cast stone, bronze",,,,,Veterans of Foreign Wars Post No. 1938,,,,,Y,,,,"World War I, War Memorial",,992904.833728224,148779.7372673899
Frank L. Dowling,"dowling, frank l.",398,Y,Manhattan,Chelsea Park,M011,4,3,9th Avenue at 27th Street,Y,1926,,Memorial gate posts,"H: 5'10"" W: 2' D: 2'",,Granite,,,,Murray and Matheson,Horatio Seymour Tammany Club,,,,,Y,,,,"Public Servant, Politcal Figure",,984368.3232422173,212264.4580667317
Richard S. Newcombe,,1113,Y,Queens,Richard S. Newcombe Square,QZ023,9,29,"Kew Gardens Rd, 80th Road, Queens Boulevard",Y,1939,,Tablet on stele in cntr.of circular wall,see memo,,"Bronze, brick wall, granite stele",,,,,Associates of Richard Newcombe,,,,,Y,,,,"Politcal Figure, Public Servant",,1031253.8790772259,199380.74072398245
Line of Defense,,920,Y,Brooklyn,Prospect Park,B073,0,39,Antile Pass,Y,,Remade c. 1987,Semi-circular tablet on boulder,"H: 24¾"" W: 33""",,Bronze,Talix foundry,,,,Sons of the Revolution (original); Prospect Park Conservancy (replacement),,,,,Y,,,,"Revolutionary War, War Memorial",,993262.510834381,182204.0621508956
Appellate Court Building,,41,N,Manhattan,,,5,2,APPELLATE COURT BUILDING; Madison Avenue at 25th St.,Y,1899,,full standing sculptures,see indiv. listings,,"North Adams, MA marble",,,see memo,,"mayor appropr. $250,000",,,,,,,,,Sculpture,,,
Flushing Memorial,Flushing Memorial,498,Y,Queens,Flushing Park Center Plots,Q100,7,20,Northern Boulevard. and Leavitt Street,Y,1925,ca. 1925,"Standing, winged female figure (heroic scale) on pedestal, in front of stele, benches at sides","Figure H: 14' W: 7' D: 3'; Pedestal H: 4' 6"" W: 14'2"" D: 10'1""",,Georgia pink marble,,,Hermon Atkins MacNeil,,,,,,,Y,,,,"World War I, War Memorial, Allegorical",,1031577.3137978017,217544.0895678103
Bronx Victory Memorial,Bronx Victory Memorial,163,Y,the Bronx,Pelham Parkway,X039,11,13,Pelham Parkway and Eastern Boulevard,Y,"September 24, 1933",1933,"Corinthian column surmounted by standing figure (heroic scale), on pedestal with four-corner extensions bearing urns; fronted by right and left base elements each with a bas-relief; terrace with steps at front has six urns",Column H: 75'; Figure H: 18'; Pedestal H: 18' W: 50' D: 27'; Terrace H: 3' W: 164' x D: 82',,Column--Cordova Texas limestone; Figure--bronze; Bas-reliefs--limestone; 4 urns--limestone; 2 urns--terra cotta,,,"Belle Kinney, Leopold F. Scholz",John J. Sheridan,Public subscription,,,Pelham Parkway World War Memorial; Bronx County War Memorial,,Y,,,,"World War I, War Memorial",,1033182.8844055533,250596.22556313872
Harlem Heights First Line of Defense Marker,Harlem Heights First Line of Defense Marker,672,Y,Manhattan,Broadway Center Plots,M095,9,7,Between 147th and 148th Streets,Y,"September 29, 1909",ca. 1909,Recessed plaque on natural boulder,"Plaque H: 1'8"" W: 1'6""; Boulder H: 3' W: 2'6"" D: 2'6""",,Bronze,"J.V. & R.V. Lamb (original plaque); Newman Brothers, Inc., Cincinnati, OH (replacement plaque)",,,,"Washington Heights Chapter, Daughters of the American Revolution",,,,,Y,,,$100,"Revolutionary War, War Memorial",,998252.7485572994,240916.48409588635
Daniel D. Tompkins,,1560,Y,Staten Island,Joseph H. Lyons Playground,R024,1,49,Bay Street & Victory Blvd.,Y,"June 21, 1932",,Tablet with text,"H: 1'8"" W: 1'6""; Boulder H: 40"" W: 40""",,"Bronze, natural granite boulder",,,Allen G. Newman,,,,,,,Y,,,,Politcal Figure,,963020.284573555,171544.32920530438
"Ecker, Frederick H.",,436,N,Manhattan,,,0,0,"north of 23rd St., e. side",Y,"August 30, 1947",,plaque on triangular shaft,shaft 7'h,,"bronze, granite",,,,,,,,,,,,,,,,,
Frederick Johnson Memorial,,823,Y,Manhattan,Frederick Johnson Park,M159,10,9,150th St. and 7th Ave.,Y,"October 23, 1971",,Stele with incised letters,"H: 3'4"" W: 1'8"" D: 7 ½""",,Barre granite,,Keystone Monument Co.,,,Frederick Johnson Memorial Committee,,,,,Y,,,,Athlete,,1001898.1930380613,239807.6628227234
Time Sculpture at Lincoln Center,TimeSculpture at Lincoln Center,1818,Y,Manhattan,Dante Park,M020,7,6,Northern point,Y,"May 19, 1999",1998,Four clocks set in three vertical faces of oblique trianguloid form on oblique trianguloid base,"West clock Diameter: 5' (approximate); north clock Diameter: 4'8"" (approximate); upper southeast clock Diameter: 4'6"" (approximate); lower southeast clock Diameter: 1' (approximate); form H: 18'; base H: 3'6"" (approximate)",Dante Fund,Form--bronze; base--granite,,,Philip Johnson,Philip Johnson / Alan Ritchie,Yaffe and Gedalio Grinberg,Y,"""$250,000 per year for 5 years for operations, repairs and maintenance of City owned public plazas at Linciln Center"" (proposal)",,,Y,,,"$750,000 (approximate)",,,989112.3278618008,220591.98143789172
"John Vincent Daniels, Jr. Plaque","Daniels, John Vincent, Jr.",1804,Y,Queens,"Vincent Daniels, Jr. Park",Q065,2,26,"Roosevelt Avenue, 51 Street, 43 Avenue",Y,ca. 1992,ca. 1992,Relief plaque on plinth,"plaque h 1'6"" x w 2' x d ½""; plinth h 2'4"" x w 2'2"" x d 1'8""",,"Bronze, light granite (unpolished)",,,,,,,,,,Y,,,,"War Memorial, World War I",,1008337.3973512203,210402.47852297127
Local Board no. 1 marker,,933,N,the Bronx,Graham Square Park,X023,1,17,"137TH ST., 3RD & LINCOLN AVES",N,1921,,"marker, pedest., plinth, capt. germ gun","4'4""h x 4'4""w x 4'4""d",,"bronze, deer isle grn, cast stone",,,captured german gun,,,,,,,,,,,"World War I, War Memorial",,,
Robert Ray Hamilton Fountain,"Hamilton, Robert Ray",666,Y,Manhattan,Riverside Park,M071,7,6,Riverside Drive at West 76th Street,Y,1906,Circa 1906,"Fountain, topped with eagle","H: 11'5"" W: 17'5"" D: 10'2""",,Tennessee marble,,,,Warren and Wetmore,"Robert Ray Hamilton, by bequest",,,,,Y,,,,,,988507.6824175566,224638.4428331405
Corporal Sam Abrams,"Abrams, Sam",3,Y,Brooklyn,Prospect Park,B073,19,39,East Drive near Grand Army Plaza,N,1945 (?),ca. 1945,Plaque on base,"Plaque H: 4""  W: 7""; Base H: 8""  W: 11""",,"Bronze, Barre granite",,,,,Fred Jacobs,,,,,,,,,"World War II, War Memorial",,1013723.5384818017,262163.4996726364
Battery Park Underpass Marker,Battery Park Underpass Marker,89,N,Manhattan,Battery Park,M005,1,1,"entrance to Brooklyn-Battery Tunnel, Whitehall and South Streets",Y,1951,ca. 1951,plaque on exterior wall,"h 2'5¾"" x w 3'6"" x d 1""",,bronze,"U.S. Bronze Sign Company, NY",,,,purchase,,,,,,,,,,,,
Admiral David Glasgow Farragut,"Farragut, David Glasgow",466,Y,Manhattan,Madison Square Park,M052,5,3,25th Street between Fifth and Madison Avenues,Y,"May 25, 1881",1880,"Standing figure (over life-size) with integral plinth, on pedestal with extended exedra wings; pedestal has bas-relief of sword in ocean waves; each wing  has a life-size bas-relief of seated female figure","Figure H: 9'; Pedestal with exedra wings H: 9' W: 17'6"" D: 9'6""",MAS/ CPF/ Madison Sq. Pk.,Bronze; Coopersberg (Pennyslvania) black granite,Adolphe Gruet,,Augustus Saint-Gaudens,Stanford White,New York Farragut Association,,,,,Y,,,,"Civil War, War Memorial, Allegorical",,987668.3094243854,209883.10915489495
Lost Battalion Hall Plaque,Lost Battalion Hall Plaque,1792,Y,Queens,Lost Battalion Hall,Q401,6,25,Queens Blvd between 62 Ave and 62 Rd; front lobby of rec center,Y,1938,1938,Irregularly-shaped relief plaque,"H: 27"" W: 38""",,Bronze,,,Bela Janowsky,,Works Progress Administration,,,,,Y,,,,"World War I, War Memorial",,1021478.3287464678,205878.5105368048
Corporal Robert Gray Tree Marker,,624,Y,Queens,Forest Park,Q015,16,30,Near Schaefer Circle,Y,,,Tree marker,,,Bronze,,,,,,,,,,Y,,,,"World War I, War Memorial, World War I, World War I",,1028156.266506061,194876.45708164573
Anthony R. Gaeta Memorial,"Gaeta, Anthony R.",1922,Y,Staten Island,Anthony R. Gaeta Park,R126,1,49,"Wyona Avenue, Willow Road, East Blvd., Victory Blvd.",Y,"October 22, 1994",1994,Relief plaque mounted on face of slab,"Plaque H: 1'6"" at center and 1'3"" at sides W: 2'6""",,Plaque--bronze; slab--Canadian granite,Modern Art Foundry,,,,,,,,,Y,,,"$5,900; DPR (capital funds)",Public Servant,,942930.6193723828,161544.7734170556
Garibaldi Marker,,572,Y,Brooklyn,Giuseppe Garibaldi Playground,B158,11,50,"82nd Street and 18th Avenue, Bensonhurst",Y,"October 3, 1990",,"Honed granite plinth, incised inscription","H: 4'3"" W: 2' D: 11""",,Granite,,A. Ottavino Corp.,,,Italian Historical Society of America and A. Ottavino Corp.,,,,,Y,,,,Politcal Figure,,984258.8529887199,161239.35572080314
Forest Hills-Rotary Club Flagstaff,,512,N,Queens,,,6,29,FOREST HILLS GARDENS; Greenway Terr. and Middle May Pl.,Y,"June 14, 1961",,small flagstaff with small plaque,,,"bronze, steel, concrete",,,,,,,,,,,,,,,,,
Antonio Meucci Memorial,,1028,Y,Brooklyn,Meucci Square,B242,15,47,"86th Street, Avenue U, West 12th Street",Y,"April 24, 1989",,Stele on base,"H: 62"" W: 52"" D:40"" Diameter: 52""",,Granite,,Ottavino,,,Italian Historical Society,,,,,Y,,,,Scientist/Inventor,,988909.4289893806,156319.90886680782
Morty Arkin Memorial Plaque,"Arkin, Morty",46,Y,Queens,Astoria Park,Q004,1,22,"Interior wall of recreation building, Morty Arkin Memorial Athletic Field",Y,"May 13, 1972",ca. 1972,Plaque,"H: 1'4"" W: 2'",,Bronze,"U.S. Bronze Sign Company, NY",,,,DPR,,,,,Y,,,,Public Servant,,1004971.5395816416,221981.55707080662
King Park (sundial fragment),,866,Y,Queens,Rufus King Park,Q023,12,0,,S,,,,,,,,,,,,,,,,,,,,,,,
Boy Scout's Tablet,Boy Scout's,144,Y,Brooklyn,Prospect Park,B073,0,39,Top of Long Meadow,Y,1919,,Tablet,,,Bronze,Gorham Co.,,,,Gift,,,Theodore Roosevelt Tablet,,Y,,,,"Politcal Figure, US President",,992445.253282547,182587.242814973
Cpl. Louis Zimmerman,,1742,Y,the Bronx,Louis Zimmerman Playground,X087,11,11,"N. Olinville, Barker, Britton Streets; on brick wall",Y,,,Plaque recessed into wall,"H: 14"" W: 24 ½""",,Bronze,,,,,Residents of New York City,,,,,Y,,,,"World War I, War Memorial",,1020556.6849204749,254854.23476363719
Fort Stirling Marker,clark street park (fort stirling),265,Y,Brooklyn,Fort Stirling Sitting Area,B036,2,33,Clark Street and Columbia Heights,Y,1925,,Tablet on plinth,"H: 17 ½"" W: 26¾""",,"Bronze, granite",,,Albert Winert,,"Gift of Fort Greene Chapter, Daughters of the American Revolution",,,,,Y,,,500.00,"Revolutionary War, War Memorial",,985230.9986822158,193750.13715581596
Luis R. Lopez Memorial,"Lopez, Luis Reynaldo",1806,Y,Staten Island,Luis R. Lopez Park,R125,1,49,Targee Street & Palma Drive,Y,ca. 1995,ca. 1995,Flagstaff on base with relief plaque and two other plaques,"Base H: 9'3""; each (?) plaque H: 1'6""",,Flagstaff--steel; base--Canadian pink granite; plaques--bronze,Modern Art Foundry,,,,,,,,,Y,,,,Policeman,,960647.9182552993,162137.29388555884
Emilio Barbosa Memorial,"Barbosa, Emilio",1787,Y,Manhattan,Bennett Park,M009,12,7,Middle of park,Y,"August 30, 1996",ca. 1996,Plaque,"H: 1'4"" W: 1'4""",,Bronze and granite,Art In Bronze,,,,Joseph Barbosa,,,,,Y,,,,"Soldier, War Memorial, World War II",,1001397.817726478,249826.72316513956
Jeanette Park Memorial,,805,Y,Manhattan,Vietnam Veterans Plaza,M046,1,1,"Coenties Slip, South and Front Streets; interior of bandstand",N,1923,,Tablet,,,,,,,,Seamen's Church Institute of NY,,,,,,,,,"World War I, War Memorial",,981665.780747056,195239.3231538087
U.S.Customs House Landmark Plaque,,1585,N,Manhattan,,,1,1,Customs House; Bowling Green,Y,1964,,plaque on exterior wall,,,bronze,,,,,the new york community trust,,,,,,,,,,,,
Sarah Willets Meyer,,1029,Y,Queens,,,7,19,"THROGS NECK BRIDGE UNDERPASS; Totten Avenue, off Bell Boulevard, Cross Island Expressway",Y,1939,,Plaque on wall,"H: 23"" W: 36 ½"" D: ½""",,"Bronze, concrete",,,,,,,,,,Y,,,,Women,,1044558.7612600476,226963.14946980774
Annadale Memorial,Annadale Memorial,39,Y,Staten Island,Annadale Park,R080,3,1,,Y,ca. 1953,ca. 1953,Plaque mounted on boulder,"Plaque H: 2' W: 1'5½"" D: ¼""",,Bronze,,,,,,,,,,Y,,,,"World War II, Korean War, War Memorial",,934857.0777767152,136530.36019138992
